{
  "config_hash": "38efa8de530f2910",
  "data_window": {
    "end": "2026-06-28T14:45:16.462667+00:00",
    "start": "2025-07-03T14:45:16.462667+00:00"
  },
  "map_pool": [
    "Abyss",
    "Ascent",
    "Bind",
    "Breeze",
    "Corrode",
    "Fracture",
    "Haven",
    "Icebox",
    "Lotus",
    "Pearl",
    "Split",
    "Sunset"
  ],
  "published_at": "2026-06-28T14:45:16.462667+00:00",
  "supersedes": null,
  "teams": [
    {
      "confidence": "medium",
      "contributors": [
        {
          "confidence": "high",
          "low_history_baseline": false,
          "maps_played": 71,
          "player": "Nicc",
          "player_score": 0.3865
        },
        {
          "confidence": "medium",
          "low_history_baseline": false,
          "maps_played": 42,
          "player": "S1Mon",
          "player_score": 0.4298
        },
        {
          "confidence": "high",
          "low_history_baseline": false,
          "maps_played": 69,
          "player": "SpiritZ1",
          "player_score": 0.3953
        },
        {
          "confidence": "high",
          "low_history_baseline": false,
          "maps_played": 57,
          "player": "Spring",
          "player_score": 0.3896
        },
        {
          "confidence": "high",
          "low_history_baseline": false,
          "maps_played": 74,
          "player": "WsLeo",
          "player_score": 0.3709
        },
        {
          "confidence": "high",
          "low_history_baseline": false,
          "maps_played": 81,
          "player": "Yuicaw",
          "player_score": 0.4029
        }
      ],
      "country": "International",
      "map_breakdown": [
        {
          "confidence": "high",
          "map": "Abyss",
          "map_score": 0.3615
        },
        {
          "confidence": "medium",
          "map": "Ascent",
          "map_score": 0.4312
        },
        {
          "confidence": "high",
          "map": "Bind",
          "map_score": 0.399
        },
        {
          "confidence": "high",
          "map": "Breeze",
          "map_score": 0.3859
        },
        {
          "confidence": "medium",
          "map": "Corrode",
          "map_score": 0.3724
        },
        {
          "confidence": "medium",
          "map": "Fracture",
          "map_score": 0.376
        },
        {
          "confidence": "high",
          "map": "Haven",
          "map_score": 0.4232
        },
        {
          "confidence": "low",
          "map": "Icebox",
          "map_score": 0.362
        },
        {
          "confidence": "high",
          "map": "Lotus",
          "map_score": 0.402
        },
        {
          "confidence": "high",
          "map": "Pearl",
          "map_score": 0.3766
        },
        {
          "confidence": "high",
          "map": "Split",
          "map_score": 0.4058
        },
        {
          "confidence": "medium",
          "map": "Sunset",
          "map_score": 0.4083
        }
      ],
      "position": 1,
      "team": "Chinese Taipei",
      "team_score": 0.392
    },
    {
      "confidence": "medium",
      "contributors": [
        {
          "confidence": "high",
          "low_history_baseline": false,
          "maps_played": 76,
          "player": "CHICHOO",
          "player_score": 0.3931
        },
        {
          "confidence": "medium",
          "low_history_baseline": false,
          "maps_played": 72,
          "player": "K1ra",
          "player_score": 0.3971
        },
        {
          "confidence": "high",
          "low_history_baseline": false,
          "maps_played": 58,
          "player": "Knight",
          "player_score": 0.3838
        },
        {
          "confidence": "high",
          "low_history_baseline": false,
          "maps_played": 86,
          "player": "Lysoar",
          "player_score": 0.3968
        },
        {
          "confidence": "high",
          "low_history_baseline": false,
          "maps_played": 76,
          "player": "nobody",
          "player_score": 0.3446
        },
        {
          "confidence": "high",
          "low_history_baseline": false,
          "maps_played": 68,
          "player": "slowly",
          "player_score": 0.4161
        },
        {
          "confidence": "high",
          "low_history_baseline": false,
          "maps_played": 68,
          "player": "ZmjjKK",
          "player_score": 0.3976
        }
      ],
      "country": "China",
      "map_breakdown": [
        {
          "confidence": "high",
          "map": "Abyss",
          "map_score": 0.3564
        },
        {
          "confidence": "high",
          "map": "Ascent",
          "map_score": 0.4427
        },
        {
          "confidence": "high",
          "map": "Bind",
          "map_score": 0.3666
        },
        {
          "confidence": "high",
          "map": "Breeze",
          "map_score": 0.4033
        },
        {
          "confidence": "medium",
          "map": "Corrode",
          "map_score": 0.3964
        },
        {
          "confidence": "high",
          "map": "Fracture",
          "map_score": 0.4054
        },
        {
          "confidence": "high",
          "map": "Haven",
          "map_score": 0.3923
        },
        {
          "confidence": "low",
          "map": "Icebox",
          "map_score": 0.362
        },
        {
          "confidence": "high",
          "map": "Lotus",
          "map_score": 0.3942
        },
        {
          "confidence": "high",
          "map": "Pearl",
          "map_score": 0.3785
        },
        {
          "confidence": "high",
          "map": "Split",
          "map_score": 0.399
        },
        {
          "confidence": "low",
          "map": "Sunset",
          "map_score": 0.3859
        }
      ],
      "position": 2,
      "team": "China",
      "team_score": 0.3902
    },
    {
      "confidence": "medium",
      "contributors": [
        {
          "confidence": "medium",
          "low_history_baseline": false,
          "maps_played": 46,
          "player": "Deryeon",
          "player_score": 0.3959
        },
        {
          "confidence": "medium",
          "low_history_baseline": false,
          "maps_played": 37,
          "player": "JayH",
          "player_score": 0.3729
        },
        {
          "confidence": "medium",
          "low_history_baseline": false,
          "maps_played": 105,
          "player": "Jinggg",
          "player_score": 0.4029
        },
        {
          "confidence": "high",
          "low_history_baseline": false,
          "maps_played": 67,
          "player": "nephh",
          "player_score": 0.3973
        },
        {
          "confidence": "medium",
          "low_history_baseline": false,
          "maps_played": 64,
          "player": "STYRON",
          "player_score": 0.3762
        },
        {
          "confidence": "high",
          "low_history_baseline": false,
          "maps_played": 68,
          "player": "Vera",
          "player_score": 0.3883
        },
        {
          "confidence": "medium",
          "low_history_baseline": false,
          "maps_played": 73,
          "player": "wayne",
          "player_score": 0.3818
        }
      ],
      "country": "Singapore",
      "map_breakdown": [
        {
          "confidence": "medium",
          "map": "Abyss",
          "map_score": 0.3688
        },
        {
          "confidence": "high",
          "map": "Ascent",
          "map_score": 0.3825
        },
        {
          "confidence": "high",
          "map": "Bind",
          "map_score": 0.3711
        },
        {
          "confidence": "medium",
          "map": "Breeze",
          "map_score": 0.3936
        },
        {
          "confidence": "high",
          "map": "Corrode",
          "map_score": 0.3945
        },
        {
          "confidence": "medium",
          "map": "Fracture",
          "map_score": 0.4445
        },
        {
          "confidence": "high",
          "map": "Haven",
          "map_score": 0.4009
        },
        {
          "confidence": "low",
          "map": "Icebox",
          "map_score": 0.362
        },
        {
          "confidence": "high",
          "map": "Lotus",
          "map_score": 0.3813
        },
        {
          "confidence": "high",
          "map": "Pearl",
          "map_score": 0.3922
        },
        {
          "confidence": "high",
          "map": "Split",
          "map_score": 0.3899
        },
        {
          "confidence": "low",
          "map": "Sunset",
          "map_score": 0.3859
        }
      ],
      "position": 3,
      "team": "Singapore",
      "team_score": 0.3889
    },
    {
      "confidence": "medium",
      "contributors": [
        {
          "confidence": "medium",
          "low_history_baseline": false,
          "maps_played": 70,
          "player": "david",
          "player_score": 0.3984
        },
        {
          "confidence": "high",
          "low_history_baseline": false,
          "maps_played": 41,
          "player": "erde",
          "player_score": 0.3929
        },
        {
          "confidence": "medium",
          "low_history_baseline": false,
          "maps_played": 61,
          "player": "keznit",
          "player_score": 0.3933
        },
        {
          "confidence": "high",
          "low_history_baseline": false,
          "maps_played": 92,
          "player": "kiNgg",
          "player_score": 0.3727
        },
        {
          "confidence": "high",
          "low_history_baseline": false,
          "maps_played": 66,
          "player": "Mazino",
          "player_score": 0.363
        },
        {
          "confidence": "high",
          "low_history_baseline": false,
          "maps_played": 70,
          "player": "Shyy",
          "player_score": 0.3939
        },
        {
          "confidence": "medium",